{"artifacts":[],"claim_state":"unresolved","code":"E_READ_SPEC_INVALID","context":{"kind":"node","node_id":"warehouse_read.nport_holdings.2024-09-30","run_id":"run:nport_identity_closure:fixture"},"coverage":"unattempted","domain_disposition":"refusal","execution":"ok","message":"warehouse read spec refused before source call","observed_at":"2026-09-16T00:00:00Z","schema":"receipt.v0"}
